Title,Link,Description,Publication Date,Author,Type
What is a CCO NFT? Why is it important for NFT creators?,https://www.blockchain-council.org/nft/cco-nft/,A CC0 NFT (creative commons- no rights reservations) is a type of copyright that allows the originator to permit other people to own their NFTs.,2022-12-19T12:35:43+00:00,Toshendra Kumar Sharma,article
How Is Web3 Shaping The Emergence of Programming Languages?,https://www.blockchain-council.org/web-3/how-is-web3-shaping-the-emergence-of-programming-languages/,Web3 technologies have emerged as a beneficial platform promising ambitious changes in the functioning of the Internet and the financial world,2022-12-08T14:43:01+00:00,Pradeep Aswal,article
Why is Web3 Ideal for Brand Building in 2023?,https://www.blockchain-council.org/web-3/why-is-web3-ideal-for-brand-building-in-2023/,Web3 technologies like Blockchain  Metaverse and NFTs will play a crucial role in shaping how we interact with the internet.,2022-12-30T09:34:48+00:00,Blockchain Council,article
NFTICALLY Launches COMEARTH: A Revolutionary Metaverse Platform,https://www.blockchain-council.org/project-of-the-month/nftically-launches-comearth-a-revolutionary-metaverse-platform/,NFTICALLY launches the public beta version of an innovative and immersive metaverse platform  COMEARTH  creating a buzz among eager users.,2023-04-18T10:23:39+00:00,Blockchain Council,article
Why are Web3 community experts important for web3 ecosystems?,https://www.blockchain-council.org/web-3/why-are-web3-community-experts-important-for-web3-ecosystems/,A community expert is a marketing executive who actively acts as a point of contact between a company and its existing and prospective new clients,2022-12-02T15:44:41+00:00,Blockchain Council,article
Career Opportunities and Benefits of Becoming a Three.js developer [UPDATED],https://www.blockchain-council.org/development/career-opportunities-and-benefits-of-becoming-a-three-js-developer/,Grab the opportunity of becoming a certified Three.js developer and build immersive metaverse experiences for top Global companies. Read more.,2022-12-06T09:09:13+00:00,Puneet Singhal,article
What is Web 5.0: All You Need to Know [UPDATED],https://www.blockchain-council.org/web-3/what-is-web-5-0-all-you-need-to-know/,Web 5.0 combines the best of Web 2.0 and Web 3.0 while taking semantic Web to the next level and supporting global media connection. Read more,2023-04-08T16:35:40+00:00,Blockchain Council,article
Why Demand For Blockchain Developers Shot Up in 2024?,https://www.blockchain-council.org/web-3/why-demand-for-blockchain-developers-shot-up/,Demand for Blockchain developer skyrocketed due to the rise of Web3 adoption  leading to shortages in skilled professionals.,2023-02-06T13:28:47+00:00,Pradeep Aswal,article
How To Become An NFT Developer?,https://www.blockchain-council.org/nft/how-to-become-an-nft-developer/,NFT developers can help businesses across various sectors by creating  deploying and maintaining NFTs on a Blockchain network,2023-02-17T08:17:44+00:00,Blockchain Council,article
How to Build a Web3 Startup? A Step-by-Step Guide,https://www.blockchain-council.org/web-3/how-to-build-a-web3-startup/,In this step-by-step guide we'll break down the essential elements and actions you need to take to launch your own Web3 startup successfully.,2024-01-18T19:15:20+00:00,Blockchain Council,article
The 5 Most Unforgettable NFTs of 2022,https://www.blockchain-council.org/nft/the-5-most-unforgettable-nfts-of-2022/,Here we'll be talking about the most popular NFTs the different types of NFT trends and many more. So let's dive in.,2023-01-20T13:50:08+00:00,Blockchain Council,article
NFT Art: How the Future of NFTs will Empower Artists,https://www.blockchain-council.org/nft/nft-art-how-the-future-of-nfts-will-empower-artists/,NFTs  or non-fungible tokens are digital assets that allow the ownership and provenance of digital art and other online media to be verified on a Blockchain.,2023-01-09T15:37:19+00:00,Toshendra Kumar Sharma,article
"Benefits of becoming a web3 game developer: Scope, Skills and Salary",https://www.blockchain-council.org/web-3/benefits-of-becoming-a-web3-game-developer-scope-skills-and-salary/,Do you want to be a Web3 game developer? It's a good choice. The gaming industry is booming  and you could forge a successful career in this exciting field with the right skills and certification.,2022-12-01T14:23:30+00:00,Blockchain Council,article
She for Web3: Women in Blockchain & Web3,https://www.blockchain-council.org/web-3/she-for-web3-women-in-blockchain-web3/,Women in Blockchain & Web3 is driving the industry to new heights. On this Women's Day it's essential to recognize the incredible talent and potential that women bring to the Web3 space.,2023-03-07T11:46:09+00:00,Blockchain Council,article
BLR Metaport: World's First Metaverse Airport Launched,https://www.blockchain-council.org/metaverse/blr-metaport-worlds-first-metaverse-airport-launched/,BLR Airport launched the first phase of its metaverse move with the launch of Metaport. The 'BLR Metaport' allows visitors and customers to experience the new Terminal 2 of the airport in a 3D digital experience using Metaverse.,2022-12-15T08:33:14+00:00,Pradeep Aswal,article
Top Five Trends To Follow In 2023 To Scale Your Web3 Business,https://www.blockchain-council.org/web-3/top-five-trends-to-follow-in-2023-to-scale-your-web3-business/,Web3  also known as the decentralized web  is an umbrella term that refers to a set of technologies and protocols that aim to give users more control over their online data and interactions.,2023-01-10T13:34:07+00:00,Pradeep Aswal,article
3D Modeling Career Pathways,https://www.blockchain-council.org/web-3/3d-modeling-career-pathways/,In this article we will discuss several 3D modeling career pathways and how you can grab the best 3D modeling jobs.,2023-02-01T14:39:42+00:00,Anshika Bhalla,article
Decentralization in Web3: Benefits and Usages,https://www.blockchain-council.org/web-3/decentralization-in-web3-benefits-and-usages/,Web3 empowers individuals  improves transparency and security  and revolutionizes traditional industries,2023-02-14T13:10:12+00:00,Anshika Bhalla,article
Top 5 Web3 Careers For Developers,https://www.blockchain-council.org/web-3/top-5-web3-careers-for-developers/,In this article we will talk about the top 5 Web3 careers for developers. By the end of this article you  as a Web3 developer will get to know the key to succeed in Web3 careers for developers.,2023-09-25T11:15:55+00:00, Blockchain Council,article
"Sortium, a Web3 Studio, Raises $7.8M in a Seed Round",https://www.blockchain-council.org/news/sortium-a-web3-studio-raises-7-8m-in-a-seed-round/,"Around 50 people work with Sortium, including Blockchain engineers, AI engineers, and a full-fledged game studio, read in-detail news…",2023-01-17T14:32:46+00:00, Blockchain Council,article
What is the Metaverse? Step-by-Step Beginners Guide 2024 [UPDATED],https://www.blockchain-council.org/guide/metaverse-guide-everything-you-need-to-know/,"Learn from our Step-by-Step Beginners Guide on ""What is the Metaverse?"" and get an in-depth understanding of the Metaverse world.",2023-01-13T17:52:09+00:00,Blockchain Council,article
Top Web3 Certifications & Training in 2024,https://www.blockchain-council.org/web-3/top-web3-certifications-training/,Discover the top web3 courses and programs to enhance your knowledge and skills in decentralized finance smart contracts and NFTs.,2023-01-06T13:24:07+00:00,Pradeep Aswal,article
Luxury Fashion meets Blockchain on Syky a Web3 Platform Powered by Seven Seven Six,https://www.blockchain-council.org/news/luxury-fashion-meets-blockchain-on-syky-a-web3-platform-powered-by-seven-seven-six/,"Alice Delahunt started the procedure by founding Syky, called &quot;psy-key,&quot; since she believed Web3 would be the future of style. Read more...",2023-01-18T16:56:31+00:00,Blockchain Council,article
Top 5 Jobs In The Web3 Space,https://www.blockchain-council.org/web-3/jobs-in-web3-space/,Web3 is reshaping the digital landscape  emphasizing decentralization and user empowerment.,2023-11-17T09:40:05+00:00,Blockchain Council,article
Why are Web3 Developers and Experts a Must to Scale Businesses Today?,https://www.blockchain-council.org/web-3/why-are-web3-developers-and-experts-a-must-to-scale-businesses-today/,An understanding of the working and elements of Web3 will help you develop a conscience of how to use Web3 to improve the scalability of a business,2022-12-29T06:46:25+00:00,Blockchain Council,article
"Web3 – Decentralization, Disruption, and Digital Assets",https://www.blockchain-council.org/web-3/web3-decentralization-disruption-and-digital-assets/,"For all that Web3 promises, decentralization has evolved into a rallying cry and even a catalyst.",2023-02-01T07:22:48+00:00,Pradeep Aswal,article
How to Mint an NFT: A Guide to Create Your Digital Artwork [UPDATED],https://www.blockchain-council.org/nft/how-to-mint-an-nft/,Wanna mint your favourite art piece into an NFT? Learn in-depth about NFT development by enrolling in our NFT Developer certification today!,2022-12-12T15:59:28+00:00,Toshendra Kumar Sharma,article
10 Most Popular Web3 Applications for 2024,https://www.blockchain-council.org/web-3/most-popular-web3-applications/,"In 2024, Web 3.0 applications, also known as decentralized applications or DApps, are reshaping the digital landscape, driven by Blockchain technology.",2023-12-08T08:47:01+00:00,Blockchain Council,article
Top 3D Animation Courses,https://www.blockchain-council.org/web-3/top-3d-animation-courses/,A 3D animation is a digital animation that uses computer software to create moving images in a three-dimensional space.,2023-01-18T15:39:52+00:00,Blockchain Council,article
Web3.js Vs Ethers.js : Know the Key Differences,https://www.blockchain-council.org/web-3/web3-js-vs-ethers-js/,Web3.js and Ethers.js are popular JavaScript libraries for building decentralized applications,2023-02-13T14:59:14+00:00,Blockchain Council,article
The Ultimate Web3 Glossary: Decoding A-Z of the Future of Internet,https://www.blockchain-council.org/glossary/web3-glossary/,The Ultimate Web3 Glossary is here! Decode A-Z of all the Web3 terms with the best glossary of Web3. Are you ready to learn the Web3 jargon?,2023-08-07T13:27:55+00:00,Blockchain Council,article
How to Become an Artificial Intelligence Engineer: Roles and More,https://www.blockchain-council.org/ai/how-to-become-an-artificial-intelligence-engineer/,Artificial Intelligence (AI) engineers design develop and deploy AI-based systems working with data scientists and software engineers to identify and solve complex problems.,2023-02-21T12:47:31+00:00,Pradeep Aswal,article
How to Land a High-Paying Web3 Job?,https://www.blockchain-council.org/web-3/how-to-land-a-high-paying-web3-job/,Summary Web3 is a transformative leap into a decentralized digital landscape built on Blockchain technology for transparency security,2023-11-16T11:27:06+00:00,Blockchain Council,article
The Future Of Social Media In The Metaverse,https://www.blockchain-council.org/metaverse/the-future-of-social-media-in-the-metaverse/,In this article we will discuss the future of social media in the Metaverse and how it is likely to change how we consume daily content in the virtual world.,2023-01-11T19:17:20+00:00,Blockchain Council,article
The Ultimate Guide to Web3 [UPDATED],https://www.blockchain-council.org/guide/the-ultimate-guide-to-web3/,Welcome to the ultimate guide to Web3 that will take you on an epic journey through the fascinating world of Web3!,2023-08-04T04:38:10+00:00,Blockchain Council,article
How will Web3 impact search engines?,https://www.blockchain-council.org/web-3/how-will-web3-impact-search-engines/,Search engines like Google have been using user data to generate influential analyses and reports that help businesses grow using user-based analytics a new version of the internet is on the verge of development. which doesnâ€™t seem wrong considering the limitations of the current Internet generation.,2023-01-25T13:47:47+00:00,Pradeep Aswal,article
